{
  "id": "person-a1b2c3",
  "display_name": "Riff",
  "nickname": null,
  "birthdate": "1990-04-12",
  "role": "adult",
  "avatar_seed": "riff-household-1",
  "source": "hub",
  "local_only": false,
  "created_at": "2026-09-03T12:00:00Z",
  "updated_at": "2026-09-03T12:00:00Z",
  "deleted_at": null,
  "hlc": "1757073600000:0:a1b2c3",
  "bio": "Curious builder and keeper of the garden.",
  "accent": "teal"
}
